{
  "version": 1,
  "updated": "2026-06-16",
  "index": {
    "module:AgentsModule": {
      "summary": "NestJS module \u2014 apps/api/src/modules/agents",
      "connects": []
    },
    "module:AiModule": {
      "summary": "NestJS module \u2014 apps/api/src/modules/ai",
      "connects": [
        "feature:ai",
        "module:DatabaseModule",
        "module:EmailModule"
      ]
    },
    "module:AnalyticsModule": {
      "summary": "NestJS module \u2014 apps/api/src/modules/analytics",
      "connects": [
        "feature:analytics",
        "module:AppConfigModule",
        "module:DatabaseModule"
      ]
    },
    "module:AppConfigModule": {
      "summary": "NestJS module \u2014 apps/api/src/modules/config",
      "connects": [
        "feature:settings",
        "module:DatabaseModule",
        "module:FilesModule"
      ]
    },
    "module:AppEventsModule": {
      "summary": "NestJS module \u2014 apps/api/src/modules/app-events",
      "connects": []
    },
    "module:AuthModule": {
      "summary": "NestJS module \u2014 apps/api/src/modules/auth",
      "connects": [
        "feature:auth"
      ]
    },
    "module:BotModule": {
      "summary": "NestJS module \u2014 apps/api/src/modules/bot",
      "connects": [
        "feature:bot",
        "module:DatabaseModule",
        "module:EmailModule",
        "module:EventsModule",
        "module:KnowledgeBaseModule"
      ]
    },
    "module:DatabaseModule": {
      "summary": "NestJS module \u2014 apps/api/src/modules/database",
      "connects": []
    },
    "module:EmailModule": {
      "summary": "NestJS module \u2014 apps/api/src/modules/email",
      "connects": [
        "feature:email",
        "feature:messages",
        "module:AppConfigModule",
        "module:DatabaseModule",
        "module:EmailOAuthModule"
      ]
    },
    "module:EmailOAuthModule": {
      "summary": "NestJS module \u2014 apps/api/src/modules/email-oauth",
      "connects": [
        "feature:email",
        "module:AppConfigModule",
        "module:AppEventsModule"
      ]
    },
    "module:EmailSyncModule": {
      "summary": "NestJS module \u2014 apps/api/src/modules/email-sync",
      "connects": [
        "feature:email",
        "module:AppConfigModule",
        "module:AppEventsModule",
        "module:EmailModule",
        "module:EmailOAuthModule",
        "module:FilesModule"
      ]
    },
    "module:EventsModule": {
      "summary": "NestJS module \u2014 apps/api/src/modules/events",
      "connects": []
    },
    "module:FilesModule": {
      "summary": "NestJS module \u2014 apps/api/src/modules/files",
      "connects": [
        "feature:files"
      ]
    },
    "module:GithubModule": {
      "summary": "NestJS module \u2014 apps/api/src/modules/github",
      "connects": [
        "feature:github"
      ]
    },
    "module:HealthModule": {
      "summary": "NestJS module \u2014 apps/api/src/modules/health",
      "connects": []
    },
    "module:KnowledgeBaseModule": {
      "summary": "NestJS module \u2014 apps/api/src/modules/knowledge-base",
      "connects": [
        "feature:bot",
        "module:DatabaseModule"
      ]
    },
    "module:MessagesModule": {
      "summary": "NestJS module \u2014 apps/api/src/modules/messages",
      "connects": [
        "feature:messages",
        "feature:tickets",
        "module:EmailModule"
      ]
    },
    "module:NotificationsModule": {
      "summary": "NestJS module \u2014 apps/api/src/modules/notifications",
      "connects": [
        "feature:notifications"
      ]
    },
    "module:QueueModule": {
      "summary": "NestJS module \u2014 apps/api/src/modules/queue",
      "connects": [
        "feature:ai",
        "feature:queue"
      ]
    },
    "module:ShiftsModule": {
      "summary": "NestJS module \u2014 apps/api/src/modules/shifts",
      "connects": [
        "feature:bot",
        "module:DatabaseModule"
      ]
    },
    "module:TicketsModule": {
      "summary": "NestJS module \u2014 apps/api/src/modules/tickets",
      "connects": [
        "feature:tickets"
      ]
    },
    "module:UsersModule": {
      "summary": "NestJS module \u2014 apps/api/src/modules/users",
      "connects": [
        "feature:tickets"
      ]
    },
    "entity:AppConfig": {
      "summary": "AppConfig table",
      "connects": [
        "entity:Notification",
        "feature:bot",
        "feature:email",
        "feature:github",
        "feature:settings"
      ]
    },
    "entity:User": {
      "summary": "User table",
      "connects": [
        "entity:AiUsage",
        "entity:BotInteraction",
        "entity:CustomerNote",
        "entity:CustomerSignal",
        "entity:MagicToken",
        "entity:Message",
        "entity:Ticket",
        "feature:analytics",
        "feature:auth",
        "feature:tickets"
      ]
    },
    "entity:MagicToken": {
      "summary": "MagicToken table",
      "connects": [
        "entity:User",
        "feature:auth"
      ]
    },
    "entity:SsoUsedToken": {
      "summary": "SsoUsedToken table \u2014 replay protection for SSO handoff JWTs (jti uniqueness)",
      "connects": [
        "feature:auth"
      ]
    },
    "entity:Agent": {
      "summary": "Agent table",
      "connects": [
        "entity:BotInteraction",
        "entity:CustomerNote",
        "entity:Message",
        "entity:NotificationRead",
        "entity:Shift",
        "entity:Ticket",
        "feature:auth",
        "feature:bot",
        "feature:tickets"
      ]
    },
    "entity:Shift": {
      "summary": "Shift table",
      "connects": [
        "entity:Agent",
        "feature:bot"
      ]
    },
    "entity:Ticket": {
      "summary": "Ticket table",
      "connects": [
        "entity:Agent",
        "entity:AiUsage",
        "entity:Attachment",
        "entity:BotInteraction",
        "entity:CustomerSignal",
        "entity:GithubIssue",
        "entity:Message",
        "entity:Notification",
        "entity:Tag",
        "entity:TicketRating",
        "entity:Topic",
        "entity:User",
        "feature:ai",
        "feature:analytics",
        "feature:bot",
        "feature:email",
        "feature:github",
        "feature:tickets"
      ]
    },
    "entity:Message": {
      "summary": "Message table",
      "connects": [
        "entity:Agent",
        "entity:AiUsage",
        "entity:Attachment",
        "entity:CustomerSignal",
        "entity:Ticket",
        "entity:User",
        "feature:ai",
        "feature:bot",
        "feature:email",
        "feature:messages"
      ]
    },
    "entity:Attachment": {
      "summary": "Attachment table",
      "connects": [
        "entity:Message",
        "entity:Ticket",
        "feature:email",
        "feature:files",
        "feature:tickets"
      ]
    },
    "entity:Tag": {
      "summary": "Tag table",
      "connects": [
        "entity:Ticket",
        "feature:tickets"
      ]
    },
    "entity:GithubConfig": {
      "summary": "GithubConfig table",
      "connects": [
        "feature:github"
      ]
    },
    "entity:GithubIssue": {
      "summary": "GithubIssue table",
      "connects": [
        "entity:Ticket",
        "feature:github"
      ]
    },
    "entity:CannedResponse": {
      "summary": "CannedResponse table",
      "connects": [
        "feature:messages"
      ]
    },
    "entity:CustomerNote": {
      "summary": "CustomerNote table",
      "connects": [
        "entity:Agent",
        "entity:User",
        "feature:analytics"
      ]
    },
    "entity:Notification": {
      "summary": "Notification table",
      "connects": [
        "entity:AppConfig",
        "entity:NotificationRead",
        "entity:Ticket",
        "feature:ai",
        "feature:github",
        "feature:notifications"
      ]
    },
    "entity:NotificationRead": {
      "summary": "NotificationRead table",
      "connects": [
        "entity:Agent",
        "entity:Notification",
        "feature:notifications"
      ]
    },
    "entity:Topic": {
      "summary": "Topic table",
      "connects": [
        "entity:Ticket",
        "feature:ai",
        "feature:analytics"
      ]
    },
    "entity:TicketRating": {
      "summary": "TicketRating table",
      "connects": [
        "entity:Ticket",
        "feature:ai",
        "feature:analytics"
      ]
    },
    "entity:CustomerSignal": {
      "summary": "CustomerSignal table",
      "connects": [
        "entity:Message",
        "entity:Ticket",
        "entity:User",
        "feature:ai",
        "feature:analytics"
      ]
    },
    "entity:AiUsage": {
      "summary": "AiUsage table",
      "connects": [
        "entity:Message",
        "entity:Ticket",
        "entity:User",
        "feature:ai",
        "feature:bot"
      ]
    },
    "entity:KnowledgeSource": {
      "summary": "KnowledgeSource table",
      "connects": [
        "entity:KnowledgeChunk",
        "feature:bot"
      ]
    },
    "entity:KnowledgeChunk": {
      "summary": "KnowledgeChunk table",
      "connects": [
        "entity:KnowledgeSource",
        "feature:bot"
      ]
    },
    "entity:BotInteraction": {
      "summary": "BotInteraction table",
      "connects": [
        "entity:Agent",
        "entity:Ticket",
        "entity:User",
        "feature:bot"
      ]
    },
    "route:POST /api/v1/tickets": {
      "summary": "POST /api/v1/tickets \u2192 TicketsController.create",
      "connects": [
        "feature:tickets",
        "module:TicketsModule"
      ]
    },
    "route:GET /api/v1/tickets": {
      "summary": "GET /api/v1/tickets \u2192 TicketsController.list",
      "connects": [
        "feature:tickets",
        "module:TicketsModule"
      ]
    },
    "route:GET /api/v1/tickets/:id": {
      "summary": "GET /api/v1/tickets/:id \u2192 TicketsController.findById",
      "connects": [
        "feature:tickets",
        "module:TicketsModule"
      ]
    },
    "route:PATCH /api/v1/tickets/:id": {